{
  "$schema": "https://json-schema.org/draft/2020-12/schema",
  "$id": "top40_ligand_inventory_v05.schema.json",
  "title": "TfR1 Top40 formal ligand conformer inventory",
  "type": "object",
  "additionalProperties": false,
  "required": [
    "schema_version",
    "inventory_id",
    "candidate_manifest_sha256",
    "expected_slot_count",
    "slots"
  ],
  "properties": {
    "schema_version": {"const": "0.5"},
    "inventory_id": {"type": "string", "minLength": 1},
    "candidate_manifest_sha256": {"type": "string", "pattern": "[0-9a-f]{64}"},
    "expected_slot_count": {"type": "integer", "minimum": 1},
    "slots": {
      "type": "array",
      "minItems": 1,
      "uniqueItems": true,
      "items": {
        "type": "object",
        "additionalProperties": false,
        "required": ["candidate_id", "conformer_name", "readiness_status"],
        "properties": {
          "candidate_id": {"type": "string", "pattern": "[ABCD](?:[1-9]|10)"},
          "conformer_name": {"type": "string", "minLength": 1},
          "readiness_status": {
            "enum": ["approved_for_formal_screening", "conversion_audit_only", "not_prepared"]
          },
          "source_sdf_path": {"type": "string", "minLength": 1},
          "source_sdf_sha256": {"type": "string", "pattern": "[0-9a-f]{64}"},
          "audit_path": {"type": "string", "minLength": 1},
          "audit_sha256": {"type": "string", "pattern": "[0-9a-f]{64}"},
          "approval_basis": {"type": "string", "minLength": 1}
        }
      }
    }
  }
}
