{
  "schema_version": "0.5",
  "inventory_id": "tfr1_top40_formal_ligands_v05",
  "candidate_manifest_sha256": "297c36027fdab031c70f799ca589635bf10349202df065ec0edfb6ed804a112e",
  "expected_slot_count": 120,
  "slots": [
    {"candidate_id": "A1", "conformer_name": "conf01", "readiness_status": "not_prepared"},
    {"candidate_id": "A1", "conformer_name": "conf02", "readiness_status": "not_prepared"},
    {"candidate_id": "A1", "conformer_name": "conf03", "readiness_status": "not_prepared"},
    {"candidate_id": "A2", "conformer_name": "conf01", "readiness_status": "not_prepared"},
    {"candidate_id": "A2", "conformer_name": "conf02", "readiness_status": "not_prepared"},
    {"candidate_id": "A2", "conformer_name": "conf03", "readiness_status": "not_prepared"},
    {"candidate_id": "A3", "conformer_name": "conf01", "readiness_status": "not_prepared"},
    {"candidate_id": "A3", "conformer_name": "conf02", "readiness_status": "not_prepared"},
    {"candidate_id": "A3", "conformer_name": "conf03", "readiness_status": "not_prepared"},
    {"candidate_id": "A4", "conformer_name": "conf01", "readiness_status": "approved_for_formal_screening", "source_sdf_path": "docking_test/vina_standardized_v04_20260907/A4/source_sdf/A4_conf01.sdf", "source_sdf_sha256": "d741207d7086f456de9e359d31e6d14b0e1987ed6efa667bc5f2e4cb8beffa7c", "audit_path": "docking_test/vina_standardized_v04_20260907/A4/audit/A4_conf01_input_audit.json", "audit_sha256": "936fd883b6ba6c20710b43428cb8fcb9545331e8264fe5875c27fff7136d40cf", "approval_basis": "completed_v04_formal_pipeline"},
    {"candidate_id": "A4", "conformer_name": "conf02", "readiness_status": "approved_for_formal_screening", "source_sdf_path": "docking_test/vina_standardized_v04_20260907/A4/source_sdf/A4_conf02.sdf", "source_sdf_sha256": "42412bec1235146f1b28effc641c41aea0b2410534faa383e2cc2ded575ce048", "audit_path": "docking_test/vina_standardized_v04_20260907/A4/audit/A4_conf02_input_audit.json", "audit_sha256": "bd1af3d9c4e495cb87c12c7e582cb648dd02664985d5d4dc635ee3c4ad2399aa", "approval_basis": "completed_v04_formal_pipeline"},
    {"candidate_id": "A4", "conformer_name": "conf03", "readiness_status": "approved_for_formal_screening", "source_sdf_path": "docking_test/vina_standardized_v04_20260907/A4/source_sdf/A4_conf03.sdf", "source_sdf_sha256": "70a6035e6b49b345436dba8cabc86e1458b4e5b669088f7ca4af7bf8696b8771", "audit_path": "docking_test/vina_standardized_v04_20260907/A4/audit/A4_conf03_input_audit.json", "audit_sha256": "e06e25d8c1fe84ee9986a8f3575975ed355193760c6df1908130624cfdd931bb", "approval_basis": "completed_v04_formal_pipeline"},
    {"candidate_id": "A5", "conformer_name": "conf01", "readiness_status": "not_prepared"},
    {"candidate_id": "A5", "conformer_name": "conf02", "readiness_status": "not_prepared"},
    {"candidate_id": "A5", "conformer_name": "conf03", "readiness_status": "not_prepared"},
    {"candidate_id": "A6", "conformer_name": "conf01", "readiness_status": "not_prepared"},
    {"candidate_id": "A6", "conformer_name": "conf02", "readiness_status": "not_prepared"},
    {"candidate_id": "A6", "conformer_name": "conf03", "readiness_status": "not_prepared"},
    {"candidate_id": "A7", "conformer_name": "conf01", "readiness_status": "not_prepared"},
    {"candidate_id": "A7", "conformer_name": "conf02", "readiness_status": "not_prepared"},
    {"candidate_id": "A7", "conformer_name": "conf03", "readiness_status": "not_prepared"},
    {"candidate_id": "A8", "conformer_name": "conf01", "readiness_status": "not_prepared"},
    {"candidate_id": "A8", "conformer_name": "conf02", "readiness_status": "not_prepared"},
    {"candidate_id": "A8", "conformer_name": "conf03", "readiness_status": "not_prepared"},
    {"candidate_id": "A9", "conformer_name": "conf01", "readiness_status": "not_prepared"},
    {"candidate_id": "A9", "conformer_name": "conf02", "readiness_status": "not_prepared"},
    {"candidate_id": "A9", "conformer_name": "conf03", "readiness_status": "not_prepared"},
    {"candidate_id": "A10", "conformer_name": "conf01", "readiness_status": "not_prepared"},
    {"candidate_id": "A10", "conformer_name": "conf02", "readiness_status": "not_prepared"},
    {"candidate_id": "A10", "conformer_name": "conf03", "readiness_status": "not_prepared"},
    {"candidate_id": "B1", "conformer_name": "conf01", "readiness_status": "not_prepared"},
    {"candidate_id": "B1", "conformer_name": "conf02", "readiness_status": "not_prepared"},
    {"candidate_id": "B1", "conformer_name": "conf03", "readiness_status": "not_prepared"},
    {"candidate_id": "B2", "conformer_name": "conf01", "readiness_status": "not_prepared"},
    {"candidate_id": "B2", "conformer_name": "conf02", "readiness_status": "not_prepared"},
    {"candidate_id": "B2", "conformer_name": "conf03", "readiness_status": "not_prepared"},
    {"candidate_id": "B3", "conformer_name": "conf01", "readiness_status": "approved_for_formal_screening", "source_sdf_path": "docking_test/vina_standardized_v04_20260907/B3/source_sdf/B3_conf01.sdf", "source_sdf_sha256": "88bb9b5304937992d894324e278de13d427567c9beb67ef556da5e7f340ff8db", "audit_path": "docking_test/vina_standardized_v04_20260907/B3/audit/B3_conf01_input_audit.json", "audit_sha256": "5e5dee2f27c63b6c47a28fa9226794c4ab72e65a137d0d038ea97a1aa77bd057", "approval_basis": "completed_v04_formal_pipeline"},
    {"candidate_id": "B3", "conformer_name": "conf02", "readiness_status": "approved_for_formal_screening", "source_sdf_path": "docking_test/vina_standardized_v04_20260907/B3/source_sdf/B3_conf02.sdf", "source_sdf_sha256": "c4c5c500f5fe60d7112037cbbdacd592ca6470f7699c85d44e33810f9414f30f", "audit_path": "docking_test/vina_standardized_v04_20260907/B3/audit/B3_conf02_input_audit.json", "audit_sha256": "ab6c079ac790364b0e45b4cb2236176b4e964d53cd2d55bfe820a7bb3f0520e5", "approval_basis": "completed_v04_formal_pipeline"},
    {"candidate_id": "B3", "conformer_name": "conf03", "readiness_status": "approved_for_formal_screening", "source_sdf_path": "docking_test/vina_standardized_v04_20260907/B3/source_sdf/B3_conf03.sdf", "source_sdf_sha256": "fac404ac8bc4a8fcaff67f30763084a78fe6070685343f57e6dc01a5c877e449", "audit_path": "docking_test/vina_standardized_v04_20260907/B3/audit/B3_conf03_input_audit.json", "audit_sha256": "93175cfb019a420c39e9102f690f68c9ad4f3e3b6eb6cd9a89d9bf814930441c", "approval_basis": "completed_v04_formal_pipeline"},
    {"candidate_id": "B4", "conformer_name": "conf01", "readiness_status": "not_prepared"},
    {"candidate_id": "B4", "conformer_name": "conf02", "readiness_status": "not_prepared"},
    {"candidate_id": "B4", "conformer_name": "conf03", "readiness_status": "not_prepared"},
    {"candidate_id": "B5", "conformer_name": "conf01", "readiness_status": "not_prepared"},
    {"candidate_id": "B5", "conformer_name": "conf02", "readiness_status": "not_prepared"},
    {"candidate_id": "B5", "conformer_name": "conf03", "readiness_status": "not_prepared"},
    {"candidate_id": "B6", "conformer_name": "conf01", "readiness_status": "not_prepared"},
    {"candidate_id": "B6", "conformer_name": "conf02", "readiness_status": "not_prepared"},
    {"candidate_id": "B6", "conformer_name": "conf03", "readiness_status": "not_prepared"},
    {"candidate_id": "B7", "conformer_name": "conf01", "readiness_status": "not_prepared"},
    {"candidate_id": "B7", "conformer_name": "conf02", "readiness_status": "not_prepared"},
    {"candidate_id": "B7", "conformer_name": "conf03", "readiness_status": "not_prepared"},
    {"candidate_id": "B8", "conformer_name": "conf01", "readiness_status": "not_prepared"},
    {"candidate_id": "B8", "conformer_name": "conf02", "readiness_status": "not_prepared"},
    {"candidate_id": "B8", "conformer_name": "conf03", "readiness_status": "not_prepared"},
    {"candidate_id": "B9", "conformer_name": "conf01", "readiness_status": "not_prepared"},
    {"candidate_id": "B9", "conformer_name": "conf02", "readiness_status": "not_prepared"},
    {"candidate_id": "B9", "conformer_name": "conf03", "readiness_status": "not_prepared"},
    {"candidate_id": "B10", "conformer_name": "conf01", "readiness_status": "not_prepared"},
    {"candidate_id": "B10", "conformer_name": "conf02", "readiness_status": "not_prepared"},
    {"candidate_id": "B10", "conformer_name": "conf03", "readiness_status": "not_prepared"},
    {"candidate_id": "C1", "conformer_name": "conf01", "readiness_status": "not_prepared"},
    {"candidate_id": "C1", "conformer_name": "conf02", "readiness_status": "not_prepared"},
    {"candidate_id": "C1", "conformer_name": "conf03", "readiness_status": "not_prepared"},
    {"candidate_id": "C2", "conformer_name": "conf01", "readiness_status": "conversion_audit_only", "source_sdf_path": "docking_test/vina_standardized_v04_20260907/C2/source_sdf/C2_conf01.sdf", "source_sdf_sha256": "6977e452e248580ca38dbacf0d0425cdde62389aaaf613244ec198831ada8fb1", "audit_path": "docking_test/vina_standardized_v04_20260907/C2/audit/C2_standardized_sdf_conversion_audit.json", "audit_sha256": "d768fa119bda22df1aca7811a119a4bb87a8287fe52699cb822ac15a89e3dae2", "approval_basis": "standardized_conversion_audit_pass_not_docking_approved"},
    {"candidate_id": "C2", "conformer_name": "conf02", "readiness_status": "conversion_audit_only", "source_sdf_path": "docking_test/vina_standardized_v04_20260907/C2/source_sdf/C2_conf02.sdf", "source_sdf_sha256": "1c3cc5afa06adc661aea219440b5125809a957c31d320e1a0b7626520ddee1eb", "audit_path": "docking_test/vina_standardized_v04_20260907/C2/audit/C2_standardized_sdf_conversion_audit.json", "audit_sha256": "d768fa119bda22df1aca7811a119a4bb87a8287fe52699cb822ac15a89e3dae2", "approval_basis": "standardized_conversion_audit_pass_not_docking_approved"},